emotion,learning_style,primary_tip,study_strategy,encouragement,resource_type
Confused,Visual Learner,Break the concept into smaller steps and draw a diagram,Use the Feynman Technique - explain it like you are teaching a 5 year old,Everyone feels confused when learning something new - confusion means you are growing,Video tutorials and visual diagrams
Confused,Reading Learner,Re-read the concept from a different textbook or source,Write down exactly what you understand and what you don't then focus on the gaps,Confusion is the first step toward understanding - keep going,Alternative textbooks and articles
Frustrated,Take a Break,Step away for 10 minutes before continuing,Use the Pomodoro technique - 25 minutes work then 5 minutes rest,Your frustration shows how much you care - that dedication will pay off,Practice problems with solutions
Frustrated,Seek Help,Ask a classmate or post your specific question online,Break the problem into the smallest possible step you can solve,Every expert was once frustrated by the same things you are facing now,Study groups and forums
Curious,Deep Dive,Follow your curiosity and explore beyond the syllabus,Connect this concept to real world applications you find interesting,Your curiosity is your greatest learning superpower - use it,Research papers and advanced resources
Curious,Hands On,Build a small project using this concept right now,Experiment by changing variables and observe what happens,Curious learners become the best innovators - keep exploring,Interactive coding environments
Confident,Challenge Yourself,Try the hardest problem you can find on this topic,Teach this concept to someone else to deepen your understanding,Your confidence is well earned - now push yourself further,Advanced challenges and competitions
Confident,Help Others,Mentor a peer who is struggling with this topic,Create your own practice problems and solve them,The best way to master something is to teach it - share your knowledge,Peer tutoring and study groups
Bored,Make It Interesting,Connect this topic to something you are passionate about,Gamify your learning with challenges and rewards,Boredom means you are ready for the next level - seek more challenge,Advanced topics and passion projects
Bored,Change Approach,Try a completely different learning format like podcasts or videos,Set a personal challenge to finish this in record time,Your brain is hungry for more - feed it with bigger challenges,Diverse learning formats